{
  "version": "1.0",
  "generated_at": "2026-05-19T11:08:42.649404+00:00",
  "global_feature_hangdang_matrix": [
    {
      "feature": "performance_cues=еҝө,е”ұ",
      "hangdang": "иҖҒз”ҹ",
      "count": 2,
      "ratio": 0.125
    },
    {
      "feature": "performance_cues=еҝө,е”ұ",
      "hangdang": "е°Ҹз”ҹ",
      "count": 2,
      "ratio": 0.125
    },
    {
      "feature": "performance_cues=еҝө",
      "hangdang": "жңӘзҹҘ",
      "count": 2,
      "ratio": 0.125
    },
    {
      "feature": "line_count=78",
      "hangdang": "иҖҒз”ҹ",
      "count": 1,
      "ratio": 0.0625
    },
    {
      "feature": "line_count=65",
      "hangdang": "е°Ҹз”ҹ",
      "count": 1,
      "ratio": 0.0625
    },
    {
      "feature": "line_count=64",
      "hangdang": "е°Ҹз”ҹ",
      "count": 1,
      "ratio": 0.0625
    },
    {
      "feature": "line_count=45",
      "hangdang": "иҖҒз”ҹ",
      "count": 1,
      "ratio": 0.0625
    },
    {
      "feature": "performance_cues=еҝө,е”ұ",
      "hangdang": "еҮҖ",
      "count": 1,
      "ratio": 0.0625
    },
    {
      "feature": "line_count=30",
      "hangdang": "еҮҖ",
      "count": 1,
      "ratio": 0.0625
    },
    {
      "feature": "performance_cues=еҝө",
      "hangdang": "иҖҒз”ҹ",
      "count": 1,
      "ratio": 0.0625
    },
    {
      "feature": "line_count=21",
      "hangdang": "иҖҒз”ҹ",
      "count": 1,
      "ratio": 0.0625
    },
    {
      "feature": "line_count=7",
      "hangdang": "жңӘзҹҘ",
      "count": 1,
      "ratio": 0.0625
    },
    {
      "feature": "line_count=4",
      "hangdang": "жңӘзҹҘ",
      "count": 1,
      "ratio": 0.0625
    }
  ],
  "by_collection": [
    {
      "collection_id": "01000000",
      "collection_name": "жҲҸиҖғ",
      "hangdang_distribution": {
        "иҖҒз”ҹ": 3,
        "е°Ҹз”ҹ": 2,
        "еҮҖ": 1,
        "жңӘзҹҘ": 2
      },
      "trait_hangdang_links": [
        {
          "trait": "performance_cues=еҝө,е”ұ",
          "hangdang": "иҖҒз”ҹ",
          "count": 2
        },
        {
          "trait": "performance_cues=еҝө,е”ұ",
          "hangdang": "е°Ҹз”ҹ",
          "count": 2
        },
        {
          "trait": "performance_cues=еҝө",
          "hangdang": "жңӘзҹҘ",
          "count": 2
        },
        {
          "trait": "line_count=78",
          "hangdang": "иҖҒз”ҹ",
          "count": 1
        },
        {
          "trait": "line_count=65",
          "hangdang": "е°Ҹз”ҹ",
          "count": 1
        },
        {
          "trait": "line_count=64",
          "hangdang": "е°Ҹз”ҹ",
          "count": 1
        },
        {
          "trait": "line_count=45",
          "hangdang": "иҖҒз”ҹ",
          "count": 1
        },
        {
          "trait": "performance_cues=еҝө,е”ұ",
          "hangdang": "еҮҖ",
          "count": 1
        },
        {
          "trait": "line_count=30",
          "hangdang": "еҮҖ",
          "count": 1
        },
        {
          "trait": "performance_cues=еҝө",
          "hangdang": "иҖҒз”ҹ",
          "count": 1
        },
        {
          "trait": "line_count=21",
          "hangdang": "иҖҒз”ҹ",
          "count": 1
        },
        {
          "trait": "line_count=7",
          "hangdang": "жңӘзҹҘ",
          "count": 1
        },
        {
          "trait": "line_count=4",
          "hangdang": "жңӘзҹҘ",
          "count": 1
        }
      ],
      "play_count": 1
    }
  ],
  "by_era_bucket": [
    {
      "era": "дёүеӣҪ",
      "hangdang_distribution": {
        "иҖҒз”ҹ": 3,
        "е°Ҹз”ҹ": 2,
        "еҮҖ": 1,
        "жңӘзҹҘ": 2
      },
      "play_count": 1
    }
  ],
  "inference_results": []
}
